text,label_name
turned earnings share eps eur versus loss share eur,positive
turned earnings share eps eur 0.08 versus loss share eur 0.04,positive
appears statistics technical surveillance authority customers switch service providers transfer numbers elisa network,neutral
expects revenue 8.4 billion 8.7 billion compared analyst estimates billion,neutral
line plans focus selected growth segments streamline corporate structure,positive
projected revenue 2.2 billion 2.3 billion slightly higher analyst estimates billion,positive
strengthen ruukki offshore business,positive
combine contents functionality current systems funding online service maintenance,positive
vodafone global director terminals said company expects sell million vodafone models year launch tens device,positive
juha jordan chief engineer glaston said reasons vacon global ac drives supplier service support centres countries glaston operates,positive
kai tulonen chief technology officer sysopen digia says mobility business suite represents significant milestone company offering telecommunications industry,positive
kemira supply additional volumes iron company plant sweden,neutral
month outokumpu sold 80 percent technology unit outokumpu technology oyj strategic goal world largest stainless steel maker,positive
week finnish metals technology group announced plans sell 80 percent technology unit company strategic goal world largest stainless steel maker,positive
madison feb -- fiskars united states patent trademark office granted trademark registration color orange iconic handles,positive
manavigator september 2010 kemira indian ivrcl finnish chemicals group kemira hel kra1v tuesday announced inked deal form joint venture india local construction firm ivrcl infrastructure projects ltd,positive
"metso provide recovery capacity tonnes dry day plant thermal stages capacity 1,600 tonnes hour",neutral
metso supply equipment process lines northland resources new iron ore project sweden exploits iron ore deposits,positive
real sales expected increased year year second quarter 2010,positive
navteq lead installed map data systems north american vehicles leader turn turn navigation data offered services north america said analyst research group minn,positive
neste oil board proposed eur dividend year 2007 compared eur year ago,positive
net interest income totaled eur 15.9 mn compared eur 15.6 mn year earlier,positive
net profit period 2009 euro 29 million,neutral
net profit period 2006 36.6 million euros,neutral
net profit period 2006 x20ac million,neutral
net profit mln compared 29.8 mln,positive
net sales expected remain level 2007,neutral
net sales group came eur4 .3 2007 group companies employed total 40 people,neutral
net sales 2006 totaled eur 302 million operating margin 16,neutral
net sales 2007 expected 10 2006,positive
net sales 2007 totalled eur 329 million operating margin 19,neutral
net sales 2008 expected level 2007,neutral
net sales lehdentekijat unit approximately eur 14 million 2007 70 employees,neutral
nokia bought chicago based navteq 2008 acquiring maps compete google maps navigation device companies tomtom nv garmin ltd,positive
nokia corp finland tuesday said received unified device contract finnish operator elisa oyj,neutral
nokia users,neutral
eur mn net interest income,neutral
employs 55 expects net sales 23 mln euro 29.8 mln fiscal 2006 2007 ending april 30 2007,neutral
operating loss eur compared loss eur second quarter 2009,positive
operating profit quarter april june 2006 amounted .2 sales eur3 .62 bn,neutral
operating profit totaled eur 18.6 mn 8.3 net sales,neutral
operating profit eur 9.8 mn compared loss eur 12.7 mn corresponding period 2009,positive
pre tax loss totaled eur 0.3 mn compared loss eur 2.2 mn quarter 2005,positive
pretax profit totalled eur 2.0 mn compared loss eur mn fourth quarter 2008,positive
pretax profit totalled eur mn compared loss eur 13.1 mn corresponding period 2009,positive
previously eb delivered custom solution lg electronics making commercially available mobile terminal vendors wireless operators,positive
previously vaahto pulp supplied headboxes roll dilution control technology stora enso mill eastern finland,neutral
production expand elcoteq locations including mexico hungary 2010,positive
profit accounting period eur 0.3 mn,neutral
rapala said estimates savings mln eur year french operations site,positive
use bottles increased rate use tape picked 2005 said previously,positive
russia accounted magazine division revenue eur mn usd mn 2009 usa 18,neutral
sales expected increase end year 2006,positive
satama net sales higher year,positive
scanfil expects net sales 2008 remain 2007 level,neutral
singapore icis -- kemira indian water infrastructure firm ivrcl agreed form join venture includes new inorganic coagulant manufacturing facility andhra pradesh state india finnish water treatment chemicals maker said tuesday,positive
present time nokian tires contract tires production china,neutral
solvay sa engaged poyry provide project management engineering procurement site services hydrogen peroxide production plant built solvay basf joint venture basf site belgium,neutral
-- central corporate credit union distribute patronage dividends members service fees incurred months july november 2008 estimated million,positive
srv raise holding company summer 2008 majority,positive
sales project resources strengthened director paul said,positive
tallink claims tallinn including electrical systems fully working order,positive
talvivaara secured 10 year agreement 100 cent main output nickel nickel entered long term zinc streaming agreement nyrstar nv,positive
tekla group net sales 2005 approximately 38 million euros,neutral
teliasonera secured deliveries support second quarter 2010,positive
50 50 joint venture called nokia siemens networks nokia network business group siemens carrier related operations creating estimated synergies 1.5 billion euros 1.9 billion 2010 nokia said,positive
acquisition boomeranger boats oy line solutions strategy developing business company acquisitions,positive
actions expected deliver annual cost savings eur15 20,positive
agreement cover monitoring maintenance server capacity service year extension option,neutral
amendment incur additional costs,neutral
announced restructuring significantly decrease company,positive
companies expect orders 2011,positive
company expects sell products russian region,positive
company said board directors proposed profit distribution eur0 share,neutral
company closed year turnover million euros,neutral
company expects net sales 65 mln euro mln 2006,neutral
company expects sales revenue .0 billion 2009,neutral
company leases prime locations producing immediate area,positive
company exported european countries africa,neutral
company brazil uruguay,positive
company reports loss period eur 0.4 mn compared loss eur 1.9 mn corresponding period 2005,positive
company net sales 2009 totalled meur 307.8 operating margin 13.5 cent,neutral
company operating profit 2006 stood 39.6 mln euro mln,neutral
company profit totaled ls,neutral
"company targets sales ls mn ls mn profit ls 300,000 ls 2007",neutral
company turned earnings share eps eur 0.03 versus loss share eur 0.01,positive
company build altogether 130 new substations end year,neutral
diesel margin remained high,positive
divestment line company plans focus selected growth segments streamline corporate structure company explained,positive
divestment raisio margarine business 2009 gave company focus grain based products,positive
earnings period included capital gain eur 8mn sale omx shares,neutral
finnish textiles clothing company marimekko corporation omx helsinki mmo1v reported wednesday november operating profit eur8 .1 net sales eur59 period january september 2008,neutral
quarter expected line analysts forecasts,neutral
fourth quarter saw rapala swing pretax profit 1.5 mln eur year earlier loss 1.2 mln 30 pct sales mln eur stronger performance north america,positive
german subsidiary produce software development services ixonos telecommunications business unit client projects,neutral
"group consolidated net sales 2008 totaled 3.4 billion euros employs approximately 13,000 persons",neutral
"group consolidated net sales 2009 totaled 1.5 billion euros employs approximately 10,000 persons",neutral
group revenue amounts eur 80 million half accounted exports,neutral
group revenue 2008 amounted eur 94 million company currently employs approximately people,neutral
group revenue 2009 amounted eur 70 million company currently employs approximately people,neutral
group expand chain include 45 stores,positive
insurance division turned profit,neutral
iso certification demonstrates moving forward quality commitments customers,positive
long term contract global,positive
members management team contribute adjustment measures temporary salary cut,positive
offer represents premium 24 stock closing price friday,positive
opening portal expansion strategy alma media marketplaces business unit,neutral
recovery demand started end 2009 continued january march 2010,positive
sale healthcare trade business supports oriola kd strategy focus pharmaceutical wholesale retail businesses,positive
sale lead pretax capital gain eur 22 million finnish company 2011,positive
segment annual revenue approximately eur400 company said,neutral
soapstone deposits area expected increase tulikivi current reserves considerably,positive
solvency capital ratio companies 2.7 times solvency limit,neutral
said contract estimated contribute eur150 net sales 2010,positive
measures expected produce annual cost savings eur 1.5 million starting 2007,positive
bring cost savings eur 3mn year,positive
acquisition solteq expand solutions offering microsoft business software products,positive
"agreement deliver storage tanks volume range 1,000 cu 3,000 cu included",neutral
agreement tietoenator provide blyk extended application business process management services infrastructure,positive
agreement ponsse provide forest machine maintenance services stora enso russian wood procurement operations,neutral
contract cramo sverige subcontractor ab provide scaffolding lkab new plant kiruna northern sweden,positive
terms agreement group committed opening order eur3 .75 benefon mobile units co branded china market,neutral
vacon office support customers brazil south america,neutral
experience number similar bridge projects nordic countries,positive
company aims annual savings eur3 main expected realized year,positive
second phase new innova building presence jyvaskyla increase total approximately floor square meters,neutral
acquisition panostaja oyj expands business area specialising digital printing,positive
said gave long term senior unsecured short term debt ratings finnish aktia bank eur1bn usd1 .4 bn euro medium term note program 25 march 2011,neutral
brazilian non profit de acquired solutions business integration solutions provider sterling commerce company said statement,positive
leipurin growing rapidly group,positive
geographical presence complements ramirent existing network brings customers east region '',positive
growth initiatives chosen geographic areas ongoing '' continued lindex opened store czech republic autumn,positive
kaupthing bank sweden found business alandsbanken '' said alandsbanken chief executive peter statement,positive
2010 16 july 2010 finnish steel maker rautaruukki oyj hel rtrks ruukki said today turned net profit eur20 second quarter 2010 net loss corresponding period year,positive
28 october 2010 finnish wood products technology supplier raute oyj hel rutav said today swung net profit eur3 months 2010 versus net loss eur5 .2 period year earlier,positive
february 2011 finnish broadband data communication systems provider teleste oyj hel tlt1v said yesterday net profit rocketed eur4 .8 2010 eur416 000 2009 lifted dividend proposal,positive
february 2011 finnish broadband data communication systems provider teleste oyj hel tlt1v said wednesday net profit rocketed eur4 .8 2010 eur416 000 2009 lifted dividend proposal,positive
agreement shb 30 december 2009 finnish financial services group aktia hel concluded market making agreement svenska handelsbanken sto shb shb parties said today,positive
texas sept -- texas department transportation awards contract teleste video distribution equipment,positive
cargotec corporation press release august 26 2008 10 finnish time cargotec macgregor business area providing marine cargo handling offshore load handling solutions received significant offshore crane order,positive
ceo company noop said growth sale premium beers biggest,positive
ebit totalled eur 14.4 mn compared loss eur 0.3 mn corresponding period 2009,positive
finnish broadband data communication systems provider teleste oyj hel tlt1v said yesterday returned net profit eur 2.7 million usd 3.8 months 2010 versus net loss eur period 2009,positive
finnish construction company lemminkainen oyj hel lem1s said yesterday build plastic plant packaging materials supplier ab oy lemminkainen kaluga industrial park russia,neutral
finnish consumer packaging manufacturer huhtamaki oyj said swung net profit mln euro mln months 2006 net loss 2.6 mln euro 3.3 mln period 2005,positive
finnish care group oral oyj posted total net profit euro 1.1 mln months 2006 versus net loss euro period 2005,positive
finnish consultancy satama interactive oyj posted net profit 1.4 mln euro 2.0 mln months 2007 compared net loss euro period 2006,positive
finnish pulp paper machinery maker vaahto group oyj swung 1.1 mln euro 1.4 mln net profit fiscal 2005 06 ended august 31 2006 euro net loss fiscal 2004 05,positive
finnish silicon wafers manufacturer okmetic oyj said swung net profit 4.9 mln euro 6.3 mln months 2006 net loss 1.8 mln euro 2.3 mln year earlier,positive
glaston efficiency measures units,neutral
growth strongest secure operator mobile operators cable operators business,positive
second quarter 2010 company net profit eur1 .7 compared net loss eur1 .3 april june 2009,positive
finnish shipping company viking line needs order new lng fuelled vessel,positive
jarmo head oil refining business neste oil says situation looks promising,positive
"adp news feb 25 2009 finnish printed circuit board pcb maker aspocomp group oyj hel acg1v said today swung net profit eur 300,000 usd 385,000 2008 versus net loss eur million",positive
adp news nov 2008 finnish retail software developer aldata solution oyj omx said today swung net profit eur 2.1 million usd 2.7 months 2008 versus net loss eu,positive
mformation nokia noted established agreements cover commercially proven standards based management mobile devices mobile device security mobile application management,positive
mn pretax profit eur mn eur 35.8 mn quarter 2006,positive
net sales increase 2005,positive
nokia deliver wcdma 3g hspa radio network including modular high capacity nokia flexi wcdma base station indosat,neutral
operating profit totaled eur 17.7 mn compared eur mn corresponding period 2007,positive
order intake hand expected stronger 2007,positive
outokumpu finland stainless steel manufacturer plans enter supply agreement indian railways,positive
profit taxes eur 0.1 mn compared eur -0.4 mn previous year,positive
profit period eur 15.6 mn compared eur 14.1 mn 2007,positive
quarterly diluted eps continuing operations came 0.21 eur compared year 0.12 eur,positive
rapala estimates net sales 2008 increase 8.0 pct 12 pct 2007 exchange rates,positive
raute posted net profit 1.8 mln euro 2.6 mln quarter 2007 compared net loss euro corresponding period 2006,positive
return equity stood 18.3 compared 15.4 quarter 2005,positive
russian export duties activate harvesting finland sales russia increase,positive
tectia corporation hel tec1v provider real time security solutions today announced appointed provider services uk distribute data security manage file transfer software,positive
bristol port company sealed million pound contract cooper handling supply 45 tonne customised reach stackers konecranes,positive
company expects net sales significantly increase 2009,positive
company net profit amounted mn 36 2004,positive
company said supply wcdma 3g hspa radio network including modular high capacity nokia flexi wcdma base station east,positive
contract traded time high april 24,neutral
ebitda compared corresponding ebitda margin 33,positive
fair value investment properties totalled eur mn compared eur mn corresponding period 2009,positive
fund fair value increase,positive
impact acquisition teleste net sales 2010 estimated approximately eur million,neutral
impact tietoenator net sales 2008 purchase expected 11 mln euro 15.9 mln,neutral
optimization steel components heating process reduce energy consumption,positive
proportion estonian lithuanian passengers tallinn helsinki route grew july,positive
savings impact beginning 2007,neutral
assignment strengthens poyry position international provider engineering project services chemical process industry,positive
new partnership agreement represents significant milestone parties,positive
tiimari latvian representative said company earned lvl 2005 profit 20 times 2004,positive
yahoo nokia said continue deliver internet experiences address core needs consumers developers operators,neutral
agreement ramirent expand range equipment services delivers destia ramirent finland managing director kari said,positive
takeover panostaja expands business area specialising digital printing previously consists subsidiaries oy oy,positive
cfo shares representing 0.50 share capital,neutral
forecast 2012 3.3,neutral
share capital alma media corporation business 1944757 eur divided shares,neutral
company listed nordic exchange helsinki,neutral
incap contract manufacturing carry manufacturing agreements factory tumkur near bangalore,neutral
operated nokia supported nokia network service management system,neutral
28 january 2011 finnish technology center operator technopolis oyj hel today invest eur22 .5 construction second phase office facility tampere,neutral
comptel corporation publish financial statements 2008 12 february 2009,neutral
finnish l&t company specialising oil building facility hamina finland 2008,neutral
shops located capital region region,neutral
carrier said area travel agency sell outlets sister chain suomen use remaining mortar presence primarily target business customers going forward,neutral
annual net sales unit eur million currently employs 55 people,neutral
following customers check home computers purchases divided different groups energy products content purchases,neutral
company holdings acquired citycon oyj,neutral
basware headquartered espoo finland,neutral
store located shopping center named company added,neutral
seats american experience clothing retail industry austrian experience winter sports goods business,neutral
according act universities acquire private funding,neutral
following strategy tikkurila established fully owned sales company tikkurila kazakhstan marketing decorative paints finnish tikkurila brand russian teks brand,neutral
asian traffic declined 3.4 cent,negative
ahlstrom employees serve customers sales offices production facilities 20 countries continents,neutral
raute headquartered nastola finland technology company serving wood products industry worldwide,neutral
consumer products manufacturer fiskars corp open distribution warehouse center creating 100 jobs,positive
according latest information benefon launch twig device 20 september 2006,neutral
atria buy shares oy kauhajoki slaughterhouse itikka co operative,neutral
"joint venture invest eur 500,000 production technology away",neutral
report capman plc ceo heikki westerlund,neutral
price specified completion date,neutral
total million invested project,neutral
finnish consultancy satama interactive oyj said november 13 2006 jarmo took position ceo,neutral
h1 08 h1 07 q2 08 q2 07 mln euro stated net sales operating profit 35.8 23.2 pre tax profit 33.6 26.9 5.1 net profit 25.1 25.4 14 4.0 eps euro 1.24 0.38 1.0 euro,neutral
nordea big sampo acquire said analyst sampo appear agenda nordea ahead,neutral
fixed mobile convergence solutions represent key value today communication market,neutral
room share component indicated '',neutral
,neutral
lowest final approval '',positive
pm central office nordea bank 19 ya building telephone 495 34 egm international business summit food business russia 2011 place,neutral
shares subscribed series share options max,neutral
15 november 2010 finnish energy company fortum oyj hel said today partners started negotiations establish new operating model energy supply turku region western finland,neutral
"561,470 new shares 2003 option rights plan packaging company huhtamaki oyj reported monday total 561,470 new shares company issued based share subscriptions 2003 option rights plan",neutral
meeting media analysts held day 10:30 stonesoft headquarters helsinki 22 interim report stonesoft ceo ilkka,neutral
meeting glisten shareholders vote bid held 12 march,neutral
available 27 october 2006 following numbers callers +1 non callers +44 20 access code,neutral
spokesman said food store center subject council local support comprise supermarket smaller store niche outlets following council local community appropriate uses '',neutral
total 185 wonderware certified available integrate support wonderware products software server wonderware information server analyst software analyst software,neutral
le coq market share percent rival beverage group percent,neutral
36 came aspo chemicals 39 aspo shipping 25 aspo systems,neutral
72 evraz group shares owned hand holding company assets business partners 50 evraz executives alexander alexander 50,neutral
bank,neutral
aker yards finland begin chinese subcontractors finnish shipyards,neutral
finnish food industry companies hk ruokatalo atria form joint venture company called produce turkey meat,positive
finnish food industry company l+ñnnen tehtaat planning changes fish product business,neutral
finnish plumbing heating systems supplier uponor temporarily laying workforce finland weeks mid july 2009,negative
finnish property investment company citycon plans issue directed subordinated convertible bonds institutional investors,neutral
finland hamina cargo terminal finnish nurminen logistics purchased warehouse ground lease rights port hamina,neutral
finland metal sector company componenta laying temporarily staff pori mill christmas 2008 january 2009,negative
member hk ruokatalo group finland scan launching joint venture slaughterhouse team southern sweden,neutral
largest construction company finland yit corporation acquire 70 shares slovak construction company,neutral
according aktia asset management finnish analysts forecasts 2009 high,negative
according business media reports usmanov planned transfer megafon stake state controlled exchange stake merged rostelecom,neutral
according ceo hannu new common visual identity required group grown,neutral
according food farm beef consumption totaled kilos finland 2007,neutral
according construction work start spring 2007 facility commissioned spring 2008,neutral
according particular attention paid residents privacy security design aleksandri street building,neutral
according statistics finnish maritime administration shipping increase january august 2009,neutral
according company decision issue summer 2010 earliest summer 2011 latest,neutral
according company lay offs temporary,neutral
according finnish russian chamber commerce major construction companies finland operating russia,neutral
according notification holdings inc group companies total shares represent tekla shares voting rights,neutral
according report elisa dna joint market share finland telecom market 59,neutral
companies present deal,neutral
sale savcor group ltd comprise savcor art corporate function investment cencorp corporation,neutral
ahlstrom employees serve customers sales offices production facilities 20 countries continents,neutral
ahlstrom share quoted nasdaq omx helsinki,neutral
ahlstrom share quoted nasdaq omx helsinki,neutral
airbus attempt people 90,neutral
alexandria va june -- michael williams park calif developed network device,neutral
rights reserved,neutral
yit capital markets day materials available company internet site investors 10:30 september 26,neutral
alma media holds 70 company remaining shares owned company key employees,neutral
entire office building occupied metso,neutral
westpac issue benchmark 18 month frn deal euros,neutral
development online businesses continue,neutral
altimo previously agreed similar deal telenor merge stakes vimpelcom kyivstar gsm,neutral
agreement 10 employees john forestry documentation functions transfer oy,neutral
result total employees given notice,neutral
result transaction sanoma budapest acquired stake online store,neutral
alternative share exchange panostaja offers cash consideration value euro 1.7 share,neutral
reorganisation measures place spring 2006 tamglass start personnel negotiations affect entire staff 33,negative
reported june 26 continued report track occupied constantly june 17 track signaling device replaced time according metro source '',neutral
outokumpu declined pct eur omx helsinki 25 pct higher omx helsinki added 0.64 pct,neutral
eet alma media annual report 2009 scheduled published calendar week,neutral
end august sampo nordea biggest shareholder stake followed state 19.9,neutral
solteq services companies operating st petersburg area include maintenance material management systems data collection solutions,neutral
autotank group aspo systems division,neutral
basware oy merged parent company present fiscal period,neutral
application considered application secure,neutral
john worked general manager senior business consultant positions international companies china,neutral
benefon target lay temporarily permanently 20 salo plant staff,negative
