text,label_name
according gran company plans production russia company growing,neutral
"technopolis plans develop stages area 100,000 square meters order host companies working computer technologies telecommunications statement said",neutral
international electronic industry company elcoteq laid tens employees tallinn facility earlier layoffs company contracted office workers daily reported,negative
new production plant company increase capacity meet expected increase demand improve use raw materials increase production profitability,positive
according company updated strategy years 2009 2012 basware targets long term net sales growth range 20 operating profit margin 10 net sales,positive
financing aspocomp growth aspocomp growth strategy increasingly focusing technologically demanding printed circuit boards pcbs,positive
quarter 2010 componenta net sales doubled eur131 period year earlier moved pre tax profit pre tax loss eur7,positive
quarter 2010 net sales increased 5.2 eur mn operating profit 34.9 eur 23.5 mn,positive
operating profit rose eur 13.1 mn eur 8.7 mn corresponding period 2007 representing 7.7 net sales,positive
operating profit totalled eur 21.1 mn eur 18.6 mn 2007 representing 9.7 net sales,positive
teliasonera tlsn said offer line strategy increase ownership core business holdings strengthen eesti offering customers,positive
stora enso norske skog real upm kymmene credit suisse raised fair value shares largest nordic forestry groups,positive
purchase agreement tons gasoline delivery hamina terminal finland signed neste oil oyj average index september plus dollars month,positive
finnish talentum reports operating profit increased eur 20.5 mn 2005 eur 9.3 mn 2004 net sales totaled eur mn eur mn,positive
clothing retail chain sepp+ñl+ñ sales increased eur 155.2 mn operating profit rose eur 31.1 mn eur 17.1 mn 2004,positive
consolidated net sales increased 16 reach eur74 .8 operating profit amounted eur0 .9 compared loss eur0 .7 prior year period,positive
foundries division reports sales increased 9.7 eur mn eur 57.5 mn corresponding period 2006 sales machine shop division increased 16.4 eur mn eur 35.4 mn corresponding period 2006,positive
helsinki afx shares closed higher led nokia announced plans team manufacture handsets nokian tyres fourth quarter earnings report analysts expectations dealers said,positive
incap contract manufacturing services pvt ltd subsidiary incap corporation finland plans double revenues 2007 2008,positive
board directors propose dividend eur0 .12 share 2010 eur0 .08 share paid 2009,positive
lifetree founded 2000 revenues risen average 40 late 30s,positive
agreement investment construction technology park st petersburg signed course days russian economy opened helsinki today,positive
megafon subscriber base increased 16.1 2009 million users december 31 market share number customers amounted 24 late 2009 23 late 2008 according teliasonera estimates,positive
net income life insurance doubled eur 6.8 mn eur 3.2 mn net income non life insurance rose eur 5.2 mn eur 1.5 mn corresponding period 2009,positive
net sales increased .3 .9 pretax profit rose eur43 .1 eur1 usd1 .4,positive
net sales surged 18.5 .8 teleste said eur20 .4 12.2 sales came acquisitions 2009,positive
nordea group operating profit increased 2010 18 percent year year billion euros total revenue percent billion euros,positive
operating profit month period increased eur13 .6 net sales increased .7 compared corresponding period 2005,positive
operating profit month period increased eur3 .1 net sales increased eur61 .5 compared corresponding period 2007,positive
operating profit month period increased eur1 .2 revenue increased eur20 .2 compared corresponding period 2005,positive
"brazilian unit finnish security solutions provider secure signed 1,500 new clients year online news source web quoted division commercial director vladimir saying",positive
company net profit rose 11.4 year million euros 2005 sales million euros 13.8 year company said earlier,positive
lithuanian beer market million liters january rise 0.8 percent year earlier figure lithuanian brewers association reporting citing results members,positive
viking line cargo revenue increased 5.4 eur mn cargo volume increased 2.4 cargo units,positive
fair value property portfolio doubled result acquisition totalled eur million,positive
10 february 2011 finnish media company sanoma oyj hel saa1v said yesterday 2010 net profit tripled .3 .1 2009 announced proposal raised,positive
helsinki today reported eps eur1 2009 increase eps eur1 .12 2008,positive
aspo plc stock exchange release february 11 2011 esl shipping ltd aspo group signed new long term contract rautaruukki corporation marine transport raw materials baltic sea,positive
commission income increased 22 eur 4.4 mn lending volume rose 13.5,positive
january traffic measured revenue passenger kilometres rpk went 3.2 capacity measured available seat kilometres ask rose 12.2,positive
january september 2010 fiskars net profit went 14 year year eur 65.4 million net sales eur million eur million,positive
net income life insurance rose eur 16.5 mn eur 14.0 mn net income non life insurance eur 22.6 mn eur 15.2 mn 2009,positive
"nyrstar agreed supply talvivaara 150,000 tonnes sulphuric acid annum use talvivaara process period supply zinc concentrate",positive
sales department store division hobby hall increased sales clothing store subsidiary seppala decreased,positive
sales risen export markets,positive
sales increased growing market rates increased operations,positive
agreement strengthens long term partnership nokia siemens networks,positive
agreement signed biohit healthcare ltd uk based subsidiary biohit oyj finnish public company develops manufactures markets liquid handling products diagnostic test systems,positive
company estimates carried investments lead increase net sales 2010 2009 reached eur million,positive
company order book stood 1.5 bln euro 2.2 bln september 30 2007 24.2 pct year international orders amounting 365 mln euro mln,positive
company said paper demand increased main markets including publication papers increased average paper prices percent compared year,positive
world second largest stainless steel maker said net profit month period dec 31 surged million us$ million us$ share million share previous year,positive
framework partnership nokia siemens networks signed initial framework purchase agreement subsidiary jsc largest manufacturer components russia,positive
seppala revenue increased 0.2 eur10 .1 finland revenue went 2.4 eur6 .8 sales abroad rose 6.2 eur3 .3 sales increased baltic countries russia ukraine,positive
shares standard chartered rose 1.2 ftse 100 royal bank shares rose barclays shares barc bcs 1.7,positive
shares nokia corp rose thursday cell phone maker said quarter earnings doubled share global handset market increased,positive
financial report published friday seb said net profit bn 2010 year earlier sek1 bn proposed 50 dividend increase sek1 .50 share,positive
sales department store division increased 15 sales clothing store subsidiary seppala increased sales hobby hall decreased 12,positive
request finnish media company alma media newspapers research manager jari finland research centre turku school future finland national economy model developed university,neutral
sweden gallerix sek denominated sales eur denominated sales 11,neutral
company supports global customers developing new technologies offers fast route product development applications volume production,neutral
investment place atria plans expand moscow market,neutral
new agreement continuation signed earlier year lemminkainen group cramo acquired entire construction machine fleet talo oy signed asimilar agreement '' said managing director finland,neutral
contract envisaged construction option units confirmed total value 500 mln euro mln,positive
june sold 30 percent stake nordstjernan investment group taken option acquire eqt remaining shares,neutral
kesko corporation stock exchange release kesko corporation aspo plc today signed agreement aspo acquires share capital kauko telko ltd subsidiary wholly owned kesko,positive
sponda plc stock exchange release december 2006 eur 1.5 billion syndicated credit facility sponda sponda signed agreement year syndicated credit facility total eur 1.5 billion,positive
stock exchange announcement 20 july 2006 basware share subscriptions warrants increase share capital total shares subscribed basware warrant program,neutral
contract covers platform optical designed increase forward return capacity transmission networks,positive
new plant planned electricity generation capacity 350 mw heat generation capacity,neutral
omx helsinki 25 index pct helsinki cap portfolio index pct higher,positive
sales growth cars considerably tires market '',neutral
maximum new shares subscribed exercising options 2004 stock option plan,neutral
result share issue number company shares increases shares share capital total eur,neutral
finnish real estate investor sponda plc said wednesday 12 march signed agreements danske bank helsinki branch year eur150 credit facility ilmarinen mutual pension insurance company year eur50 credit facility,neutral
route helsinki finland tallinn estonia cargo volumes increased 36 cargo volumes finland sweden fell,neutral
measures included increasing synergies scale grimaldi group personnel adjustments excess,neutral
rinkuskiai raised sales 18.1 percent million liters sales kauno alus grew 14.3 percent liters,positive
telecomworldwire-7 april 2006 tj group plc sells stake morning digital design oy finnish company tj group plc said friday april signed agreement selling shares morning digital design oy edita oyj,neutral
telecomworldwire-7 april 2006 tj group plc sells stake morning digital design oy finnish company tj group plc said friday april signed agreement selling shares morning digital design oy edita oyj,positive
new series shares subject trading helsinki stock exchange main list old series shares july 2006,neutral
fuel purchase contracts signed months delivery september november,neutral
tiimari operates stores countries -- including core finnish market -- generated turnover mln eur 2005,neutral
agreement biohit focus supplier pipettors disposable tips vwr customers europe,positive
combination services enabling offer complex strengthened service chain limited baltic port connections getting access world wide grimaldi network mediterranean africa north america says,positive
coming point allows investigators story high resolution video,neutral
company expects turnover 2010 slightly increase level 2009 adding market poor forecasts market development contract manufacturing business current year '',positive
acquisition considerably increase kemira sales market position russian metal industry coatings market,positive
january september 2007 finnlines net sales rose eur mn eur mn corresponding period 2006,positive
adjusted changes group structure division net sales increased 1.7,positive
change operational growing business '' said director marketing communications fiskars,positive
invest physical infrastructure provide know managing developing science technology parks '' said sunrise valley director,positive
february 2011 finnish broadband data communication systems provider teleste oyj hel tlt1v saw net profit eur2 .1 quarter 2010 000 period 2009,positive
finnish aktia group operating profit rose eur 17.5 mn quarter 2010 eur 8.2 mn quarter 2009,positive
finnish bank àland consolidated net operating profit increased eur 4.8 mn quarter 2005 eur 6.4 mn quarter 2006,positive
finnish financial group aktia reports operating profit eur mn january september 2009 eur mn corresponding period 2008,positive
finnish high technology provider vaahto group reports net sales eur mn accounting period september 2007 february 2008 increase 11.2 year earlier,positive
net sales finnish food industry company l+ñnnen tehtaat continuing operations increased 13 2008 eur mn eur mn 2007,positive
individual promotion generated slightly higher expected revenues,positive
biohit services current genesis customers customer base expected expand result agreement,positive
operating profit turnover month period increased respectively eur0 .9 eur8 .3 compared corresponding period 2005,positive
circulation revenue increased finland sweden 2008,positive
clothing chain sepp+ñl+ñ net sales increased 7.0 eur 30.8 mn,positive
construction volumes grow rate 10 15 percent annually,positive
finnish swedish construction markets estimated annual growth 2008,positive
biohit estimates total net sales continue grow 2009 favourable trends net sales lead profit 2009,positive
2009 fiskars cash flow operating activities amounted previous year,positive
"lithuania operating profit rose eur eur 70,000 corresponding period 2005",positive
fourth quarter 2008 net sales increased eur mn eur mn fourth quarter 2007,positive
international sales rose 59.8 eur mn,positive
kalmar generated net sales 11.3 mln euro mln 2005,neutral
net sales grew period x20ac million million x20ac million 2006,positive
net sales increased eur655 april june 2010 year earlier,positive
net sales rose year year eur59 .6 number chargers delivered went 41 million,positive
net sales totaled eur mn eur mn corresponding period 2005,positive
nokia noted average selling price handsets declined period mobile phone profit margin rose 22 percent 13 percent year ago quarter,positive
operating profit increased 145.1 eur 8.3 mn eur 3.4 mn,positive
operating profit margin increased 11.2 11.7,positive
operating profit rose eur mn eur 1.22 mn corresponding period 2009,positive
operating profit rose eur eur 2.8 mn fourth quarter 2008,positive
operating profit eur mn eur 23.0 mn,positive
ramirent net sales second june 30 euro million million 3.3 percent increase compared euro million quarter year,positive
revenue grew percent x20ac million million x20ac million,positive
ruukki announced signed agreement aker solutions norway supply 24 september 2010 unit finland,positive
ruukki delivery volumes selling prices showed favourable development company comparable net sales grew 50 year year ceo said,positive
sanoma magazines net sales estimated grow 2006,positive
bank forecasts finland grow 2010 2011,positive
"circuit overall production rate weekly basis excess average 40,000 tonnes day volumes excess 50,000 tonnes day reached individual days",positive
company consolidated operating profit amounted eur mn eur 4.14 mn year year,positive
department store division reported increase sales cent,positive
fair value company investment properties grew eur billion end march 2009 eur million year ago,positive
quarter best quarter 2009 net sales operating margin rose 12.2,positive
major breweries increased domestic beer sales 4.5 cent year 256.88 million litres 245.92 million litres 2004,positive
transaction adds fourth net sales,positive
operating profit rose 26.9 eur million,positive
purchase cramo second largest rental services provider latvian market,positive
priority 2009 strengthen company balance sheet increase cash flow '' ceo hannu said,positive
purchase operations yit strategy expand offering building system services '',positive
21 october 2010 finnish fishing tackle company rapala vmc corp hel rap1v said today net profit rose eur18 .9 months 2010 eur15 .1 period year earlier,positive
structures bim building information modeling software tekla model based software provider construction management delivery university project,neutral
according finnish metso minerals value company orders gone eur 1.9 bn 12 months,positive
finnish aldata solution signed contract supply gold system french retail chains,positive
finnish bank àland reports operating profit rose eur 21.3 mn second quarter 2009 eur 6.1 mn corresponding period 2008,positive
finnish financial group aktia operating profit 2009 increased eur mn eur 6.6 mn 2008,positive
finnish forest machinery manufacturer ponsse net sales grew eur mn quarter 2010 eur 37.5 mn corresponding period 2009,positive
finnish kci konecranes raised net sales growth estimate 2006 25 35,positive
finnish okmetic manufactures processes silicon wafers semiconductor sensor industries norwegian solar wafer company norsun signed contract okmetic supply norsun silicon crystals use solar cell manufacturing,positive
finnish pharmaceuticals company orion net sales rose eur quarter 2009 eur quarter 2008,positive
finnish ponsse signed agreement africa distribution support ponsse forest machines harvester heads information systems south africa,positive
south african sappi largest foreign forest industry company operating finland result acquisition finnish real corporation graphic papers business unit,positive
according deputy md pekka aim double turnover years,positive
according hkscan finland plan increase j+ñrvi suomen portti net sales eur eur 100mn,positive
advertising circulation revenues grew 3.4 0.4 respectively,positive
takeover cramo second largest rental services provider latvian market,positive
significant sales increase 18.6 russia,positive
alma media expects net sales increase forecast previously,positive
lemmink+ñinen profit accounting period went eur 3.1 mn eur mn year ago,positive
end march 2007 group order book eur 39.6 mn 42 corresponding period 2006,positive
time profit company increased 10 h1 reached ls,positive
aviation systems maintenance based kansas generated net sales usd 2.6 million 2008,neutral
increased share meat offering number new products segment '' said,positive
operating profit net sales 12 month period increased respectively eur10 .5 eur28 .8 compared financial year 2004,positive
operating profit net sales 12 month period increased respectively eur20 .8 .7 compared financial year 2004,positive
operating profit net sales 12 month period increased respectively eur21 .5 .1 compared 2005,positive
operating profit net sales 12 month period increased respectively eur4 .7 .7 compared 2004,positive
operating profit net sales month period increased respectively 3.4 compared corresponding period 2006,positive
operating profit net sales month period increased respectively eur13 .8 .6 compared corresponding period 2007,positive
operating profit net sales month period increased respectively eur0 .4 eur3 .2 compared corresponding period 2005,positive
operating profit net sales month period increased respectively eur18 .1 .6 compared corresponding period 2006,positive
operating profit net sales month period increased respectively eur7 .5 eur655 .5 compared corresponding period 2005,positive
operating profit net sales month period increased respectively eur15 .1 eur131 .5 compared corresponding period 2005,positive
operating profit net sales month period increased respectively eur16 .0 compared corresponding quarter 2006,positive
operating profit sales month period increased respectively eur0 .3 eur13 .1 compared corresponding period 2005,positive
operating profit turnover month period increased respectively eur2 .4 eur43 .8 compared corresponding period year ago,positive
operating profit turnover month period increased respectively eur17 .6 .9 compared corresponding period 2007,positive
operating profit turnover month period increased respectively eur0 .1 eur29 .0 compared corresponding period year ago,positive
cargo volume grew,positive
cargo volume increased approximately,positive
comparable operating profit totaled eur eur 2004,positive
digia said consolidated net sales january june 2010 .8 9.7 period 2009 eur61 .9,positive
diluted earnings share eps rose eur eur 0.05,positive
diluted earnings share eps rose eur versus eur,positive
diluted earnings share eps rose eur eur 0.64,positive
diluted earnings share eps rose eur eur 0.50,positive
diluted eps rose eur3 eur0 .50,positive
ebit margin 1.4 5.1,positive
editor note grimaldi generated 1.7 bln euro bln turnover 2005 ansa reported 29 2006,neutral
eps quarter eur0 .00 compared eur0 .01 quarter 2008 representing group net sales quarter eur15 .3 2.8 compared eur14 .9 quarter 2008,positive
eps continuing operations came 0.30 eur,positive
equity ratio compared quarter 2007 net sales frozen foods business totaled eur 11.0 quarter 2006,positive
eur928 000 q1 2010 2010 finnish textile clothing design company marimekko oyj hel mmo1v said today net profit rose eur928 000 quarter 2010 eur13 000 corresponding period year earlier,positive
finland based elcoteq se privately held provider electronics manufacturing services communications companies said thursday signed long term manufacturing supply deal communications equipment company corp,positive
finnish cutlery hand tools maker fiskars oyj abp hel fisas said today net profit rose eur million usd 33.6 quarter 2010 eur million year earlier,positive
finnish department store chain stockmann oyj abp net profit rose 39.8 mln euro mln months 2007 mln euro mln period 2006,positive
finnish lifting equipment maker konecranes oyj said july 30 2008 net profit rose mln euro 111.1 mln half 2008 mln euro 89.1 mln period 2007,positive
finnish messaging solutions developer tecnomen corporation omx helsinki said thursday 11 december received expansion order convergent charging solution latin america,positive
finnish metal industry solutions supplier outotec oyj net profit rose mln euro mln months 2007 mln euro mln period 2006,positive
finnish metal products company componenta oyj net profit rose mln euro mln quarter 2007 5.3 mln euro 7.3 mln period 2006,positive
finnish office supplies computer accessories dealer group plc said net profit rose 1.3 mln euro 1.7 mln 2006 1.13 mln euro 1.5 mln 2005,positive
finnish security privacy software solutions developer stonesoft oyj said january 2008 preliminary sales stonegate products grew 59 pct year year 3.6 mln euro 5.3 mln fourth quarter 2007,positive
finnish silicon wafer technology company okmetic oyj omx helsinki okm1v reported thursday august operating profit eur5 .3 period january june 2008 eur3 .3 corresponding period 2007,positive
finnish software developer solutions oyj said net profit increased 3.5 mln euro 4.6 mln 2006 2.3 mln euro 3.0 mln 2005,positive
quarter underlying operating profit rose 41 mln eur 33 mln year earlier,positive
following acquisition strengthen presence finland serving operators office market mobile fixed networks construction installation maintenance services,positive
months 2010 company net profit rose eur30 corresponding period 2009,positive
helsinki afx retail wholesale group kesko reported net sales mln eur february increase 10.8 pct year year,positive
net sales 2010 seen grown .3 .3 2009,positive
sales returned growth april june 2010 ceo pekka said,positive
ragutis controlled finnish brewery reported 5.4 cent rise beer sales million litres held cent market share,positive
svyturys utenos alus controlled nordic group baltic beverages holding bbh posted 4.7 cent growth beer sales january million litres,positive
2007 generated revenue nok approx,neutral
addition kone signed year maintenance contract escalators,positive
december members lithuanian brewers association sold total 20.3 million liters beer increase 1.9 percent sales million liters december 2004,positive
january september 2009 group net interest income increased eur mn eur mn january september 2008,positive
q1 2010 bank àland net interest income increased eur 9.1 mn eur 9.7 mn,positive
sweden operating profit period review totaled eur 3.4 mn 30.8 corresponding period 2005,positive
fourth quarter 2009 orion net profit went 33.8 year year eur33,positive
second quarter 2010 group net profit rose eur 3.1 million eur 2.5 million april june 2009,positive
second quarter 2010 group net profit rose eur3 .1 eur2 .5 april june 2009,positive
quarter net sales increased 12 year year eur million comparable currency rates growth,positive
quarter net sales increased 12 year year .5 comparable currency rates growth,positive
incap estimates generate revenue 10 mln euro 13.2 mln indian operations 2007,neutral
market share widened 48.51 percent percent year earlier,positive
total annual revenue comes 160 mln .3 mln euro,neutral
kesko agro eesti retailer wholesaler grain agricultural warehousing machinery accessories net sales million euros 2007 increase tenth year,positive
kesko car import business auto saw sales grow 17.1 pct,positive
kone net sales rose 14 year year months 2008,positive
adp news feb 11 2009 finnish management software solutions provider ixonos oyj hel said today net profit rose eur 3.5 million usd 4.5 2008 eur 3.1 million 2007,positive
adp news feb 12 2009 finnish solutions provider affecto oyj hel afe1v said today net profit rose eur 8.5 million usd 11 2008 eur million 2007,positive
adp news feb 2009 finnish fishing tackle company rapala vmc corp hel rap1v said today net profit rose eur 19.2 million usd 24.6 2008 eur 17.5 million 2007,positive
adp news nov 2008 finnish electronic measurement products solutions maker vaisala oyj omx vaias said today net profit rose eur 18 million usd 23.1 months 2008 eur,positive
adp news oct 29 2008 finnish lifting equipment maker konecranes oyj omx kcr1v said today net profit rose eur million usd months 2008 eur million,positive
metso expects net sales increase 10 2008 comparable exchange rates,positive
real generated turnover eur5 .6 bn 2006 employees,neutral
"neste oil corp signed long term procurement contracts oy oy owned finnish food manufacturers supply animal fat biodiesel production neste 200,000 porvoo finland refinery",positive
net interest income increased 4.5 eur 31.4 mn eur mn 2004,positive
net interest income eur mn eur mn 2008,positive
net interest income eur 39.3 mn eur 32.7 mn,positive
net sales vegetable oil business rose eur 10.6 mn eur 10.1 mn,positive
nokia multimedia net sales totaled eur 5.7 bn 45 corresponding period 2005,positive
operating income rose eur mn eur mn 2009,positive
