text,label_name
actions include cutting expensive shifts production system general cost cutting program,neutral
typically transmission power level decreased predefined value,neutral
bioheapleaching makes extraction metals low grade ore viable,neutral
dubai nokia announced launch comes music '' ground service new way people enjoy music,positive
rapala vmc corporation stock exchange release october 10 2008 kaupthing bank oyj '' informed rapala vmc corporation rapala '' interrupted liquidity providing rapala share time,negative
analyst satama ceo said google gave away google analytics free,neutral
block court de city north started vehicle went inside house tuesday leaving door open,neutral
negotiations concern 246 salaried senior salaried employees scheduled completed weeks,neutral
end uses include roof structures non structures vehicles packaging boxes construction site structures shelters limited number concrete,neutral
"offer challenging interesting employment 20,000 people 20 countries europe",neutral
offer clients integrated management consulting total solutions complex projects efficient best class design supervision,neutral
research shows access information technology factors small businesses especially work network based environment,neutral
block harri koskinen light introduced 1996 bestseller,positive
amer bought salomon october said job cuts aimed boosting competitiveness,neutral
increases signaling traffic network resources allows fewer smartphones connect,negative
note clients published dutch broker described company quarter results soft noted elcoteq retained guidance dealers said,neutral
m2 communications liability information provided information world wide web,neutral
rosen cautious second half year,neutral
eb tough voip field phone equipped integrated ethernet connectivity enables innovative applications,neutral
ship delayed estimated completed spring 2010,negative
tallink significant drop problems system taken operation october sale trailer ferry wind route stockholm riga won passengers helsinki stockholm route,negative
finnlines estimated annual general meeting 2008 financially tough year large investments,negative
adjustment fall price level contrast effective,negative
17 march 2011 goldman sachs estimates negative prospects norwegian mobile operations norway telenor asa osl tel sweden teliasonera ab sto tlsn short term,negative
ensure low operational cost radio networks modules software upgraded remotely,positive
based quarter result existing order backlog new order prospects company expects year sales contract 25 2008 gross margin stay healthy level operating profit margin lower 2008 lower sales volume,negative
key shareholders finnish services provider tietoenator oyj friday rejected eur1 .08 billion billion offer buyout shop nordic capital giving new life possible counter offer blackstone group lp norwegian telecom telenor asa,positive
questions visitors big team problems setting social media channels,neutral
stores 16 march 2010 finnish stationery gift retailer tiimari hel tii1v said yesterday cut total 28 jobs units tiimari retail ltd gallerix finland ltd result closure shops,negative
"local waste management company turun planned set 150,000 tonne waste burning facility",neutral
according chairman michael organizations raisio weak performance,neutral
result russia import restrictions finnish dairy companies canceled august 2010,positive
finnish forestry company upm kymmene waste management company lassila tikanoja said jan 30 planning produce ethanol energy commercial industrial waste,neutral
driver left car suspect forced gunpoint drive durham,negative
belchatow runs belchatow coal fired power plant fortum start ccs demonstration project jointly teollisuuden voima oyj tvo finnish utility jointly owned pori coal fired facility,neutral
chain trying cut costs vendors fitness equipment manufacturer precor prices,neutral
biotie north american licensing partner somaxon pharmaceuticals started phase ii iii clinical study patients suffering pilot phase ii study nicotine smoking cessation,neutral
24 hour news try icis news click trial '' icis news,neutral
black type cap black,neutral
administrators indicated need 900 job cuts irish insurer 15 months,negative
products low fat content,neutral
total need staff cuts corresponds 300 man years,negative
according product manager lassi building power plant mixed waste helsinki good idea production combined power plants natural gas,neutral
according scanfil demand telecommunications network products significantly quarter 2006 situation expected remain rest year,negative
finnair believes strike cause daily net losses excess eur 2mn canceled passenger routing,negative
helsinki thomson financial shares closed little changed cargotec huhtamaki dropping sharply second quarter reports,negative
airline estimated cancellation flights closure european process traffic caused company loss eur20 including costs passengers,negative
announcement comes weeks key licensing agreement expires companies payments texas instrument use qualcomm technology,negative
finland op pohjola staff union group insurance sales tasks company refused sale insurance account determining,negative
ruukki group calculates lost eur 4mn failed project,negative
samsung currently place lost ground quarter dropping 1.8 11.1 share overall,negative
baltimore police fire pension 1.5 billion lost 3.5 million scheme,negative
"said strike extremely '' 1,300 participants reporters begin finland day eu summit russian president vladimir lahti 100 kilometers 60 north helsinki",negative
small firms suffering moment likely money trouble '' added,negative
altogether finnair canceled 500 flights strike,negative
operating result excluding items totaled eur 9.1 mn compared eur 10.6 mn continuing operations excluding items 2004,negative
dealers said share hit investor disappointment refining margin usd quarter performance shipping unit saw ebit drop mln eur 20 mln eur year fall volumes tanker rates,negative
making matters difficult company said higher oil gas prices pushed cost energy raw materials transportation,negative
improved voice capabilities customers way requirements providing competitive advantage,positive
finnair able operate leisure flights despite strike,positive
business idea budget sport offer customers wide range high quality sports equipment clothing low prices company said,neutral
headboxes equipped modern consistency control system ensure cross machine profile plasterboard,neutral
headboxes equipped modern consistency control system ensure cross machine profile plasterboard company said statement received lesprom network,neutral
small investors shares end risk investors,negative
result burdened increased fixed costs associated operations china restructuring costs japan,negative
transaction real sappi signed long term agreement supply pulp smaller services supplies,positive
sales 14 cent finland 27 cent abroad sales lifted strong growth sales russia lithuania,neutral
asia earlier japan index fell percent hong kong index rose 0.56 percent,neutral
february 2011 finnish privacy security software developer tectia oyj hel tec1v said wednesday set strategic business units managed security mobile authentication,neutral
operating profit 12 month period decreased eur2 .9 turnover increased .5 compared financial year 2004,negative
operating profit 12 month period decreased eur28 .2 net turnover increased compared financial year 2004,negative
operating profit 12 month period decreased eur5 .4 net sales increased .0 compared financial year 2004,negative
operating profit 12 month period decreased eur9 .6 net sales increased .0 compared 2005,neutral
operating profit month period decreased .9 sales increased eur1 compared corresponding period 2006,neutral
operating profit month period decreased eur21 net sales increased .9 compared corresponding period 2007,negative
operating profit month period decreased eur1 .65 net sales increased eur14 .6 compared corresponding period 2005,negative
half 2008 bank operating profit fell eur 11.8 mn eur mn net interest income increased eur 20.9 mn eur mn half 2007,negative
operating profit 12 month period decreased .5 net sales increased .3 compared 2007,negative
operating profit 12 month period decreased eur17 .9 net sales increased eur58 .3 compared 2007,negative
operating profit month period decreased .9 net sales increased .7 compared corresponding period 2007,negative
comparable operating profit quarter decreased sales increased compared quarter 2007,negative
earlier today finnish rival uponor oyj cut year sales growth forecast pct 10 pct tough conditions germany currency factors,negative
fourth quarter 2009 atria net loss shrank eur 1.2 million eur 5.9 million net sales contracted eur million eur million,positive
operating loss totalled eur 0.3 mn profit eur 5.1 mn half 2009,negative
operating loss totalled eur 0.9 mn profit eur 2.7 mn,negative
pretax loss totaled eur 1.2 mn profit eur 2.1 mn 2004,negative
group operating loss eur 0.8 mn profit eur 2.5 mn 2004,negative
finnish national carrier said net loss april june million net profit million year earlier,negative
generated operating loss eur mn profit eur 43.9 mn,negative
highest growth china demand continue north america upm said,neutral
upm said lower net profit x20ac million us$ million second quarter mainly charges,negative
marubeni participated green house gas emission reduction projects obtained emissions credit projects provided japanese clients,neutral
companies partner developing cholesterol lowering brand benecol,positive
consolidated unaudited results amanda capital ifrs reporting standards,neutral
unaudited consolidated results aspocomp group ifrs reporting standards,neutral
aspocomp group oyj stock exchange release december 15 2006 pm according disclosure received today aspocomp group oyj share henrik nyberg aspocomp group oyj share capital votes decreased percent,neutral
sales fell abroad increased finland,neutral
association data cover sales figures 100 small local breweries sales imported beer products actual market shares members smaller given report,negative
total offers received contracting authority participating contract contract allotted affecto finland oy,neutral
pm omx helsinki 25 0.30 pct lower omx helsinki 0.37 pct volume 256 mln eur,negative
pm omx helsinki 25 pct omx helsinki pct lower mln eur turnover,negative
compared ftse 100 index fell 35.2 points 0.6 day relative price change 0.6,neutral
elcoteq se europe largest contract electronics maker set unit bangalore association advisory mumbai,neutral
helsinki afx kci konecranes said resources inc share voting rights finnish cranes company fell week pct pct october 2005,negative
january august 2009 imports sea container trailer units fell exports corresponding period 2008,negative
got brand new bag,neutral
airline share price closed slightly x20ac .74 helsinki,negative
omx helsinki 25 ended 0.47 pct lower omx helsinki 0.21 pct bln eur turnover,negative
sees provide low gypsii platform takes location information produce index world,neutral
information released september 2008 nokia american shares fell,negative
finnish shares traded stora enso closed 0.33 pct lower eur upm kymmene 0.28 pct eur metso pct eur,neutral
"finnish construction company yit number start market financed residential units 2007 2,300 previously announced",negative
huhtamaki market biggest pct lower eur omx helsinki 25 0.32 pct higher omx helsinki 0.47 pct,negative
pm omx helsinki 25 index 0.32 pct lower,negative
close omx helsinki 25 0.01 pct lower points omx helsinki 0.05 pct points bln eur turnover,negative
body credit february 24 2014,neutral
capacity seikku sawmill pori sawmill pietarsaari result 60 people laid weeks starting mid said,negative
previously ordered sets start producing electricity end october 2010 said,neutral
sales local currencies decreased 0.5 percent number subscribers rose 12.7 million total million end fourth quarter company said,neutral
company confirmed estimate lower revenue 2009 year ago eur 93.9 million usd given interim report august,negative
company expects net sales 2009 remain 2008 level,negative
measures result decreased demand technical design product information,negative
omx nordic 40 omxn40 index comprising 40 traded nordic stocks nasdaq omx exchange closed 0.87 points thursday,negative
shall decrease capital reserves,negative
net sales period expected fall year result non recurring items expected red,negative
finland bank àland reports operating profit fell eur 6.1 mn second quarter 2008 eur 7.5 mn second quarter 2007,negative
budapest august 10 mti finnish electronics maker elcoteq lay 700 workers plants hungary end september falling orders communications director elcoteq local unit krippl told mti monday,negative
earnings share eps 2005 decreased eur0 eur1 .15 2004,negative
finnair tallinn based subsidiary carried passengers decline routes helsinki baltic capitals southern finland,negative
helsinki afx kesko corp expected report lower second quarter eps today tax charges earnings lines seen higher year year analysts said,negative
q1 2009 bank àland net interest income weakened 10 eur 9.1 mn,negative
adpnews aug 2009 finnish media group ilkka yhtyma oyj hel ilk2s said today net profit fell 45 year eur 5.9 million usd 8.4 half 2009,negative
operating profit 2009 lower outlook published earlier,negative
operating profit continuing operations fell eur mn eur mn half 2007,negative
revenue quarter totaled billion percent billion fourth quarter 2008,negative
sampo bank market share lending 13.6 14.4 quarter 2008,negative
sanoma news advertising sales decreased 22 year,negative
26 october 2010 finnish environmental management company lassila tikanoja oyj hel lat1v l&t said today net profit declined eur20 .9 months 2010 eur27 .6 period year earlier,negative
finnish bank àland reports operating profit fell eur 4.9 mn quarter 2007 eur 5.6 mn quarter 2006,negative
finnish bank àland reports operating profit eur 2.2 mn quarter 2010 eur 6.3 mn corresponding period 2009,negative
finnish electronics contract manufacturer scanfil reports net sales eur mn 2006 eur mn 2005,negative
finnish electronics contract manufacturer scanfil reports net sales eur 58.9 mn second quarter 2007 eur mn year earlier,negative
finnish exel composites technology company designs manufactures markets composite profiles tubes industrial applications reports net sales decreased 0.6 second quarter 2010 eur 19.2 mn eur mn corresponding period 2009,negative
finnish geosentric net sales decreased eur january march 2009,negative
finnish kemira net sales eur decreased eur mn january june 2009 eur mn january june 2008,negative
finnish plumbing heating systems supplier uponor net sales continuing operations decreased 9.4 2008 eur mn eur mn 2007,negative
finnish plumbing heating systems supplier uponor net sales continuing business operations decreased eur mn july september 2008 compared eur mn quarter 2007,negative
finnish scanfil contract manufacturer systems supplier communication industrial electronics reports net sales eur mn half 2008 eur 111.1 mn year earlier,negative
finnish scanfil systems supplier contract manufacturer communications sector electronics industry reports net sales totalled eur mn half 2010 eur 99.5 mn half 2009,negative
finnish scanfil systems supplier contract manufacturer communications sector electronics industry reports net sales eur mn quarter 2009 cent smaller corresponding period 2008,negative
finnish shipping company finnlines grimaldi group reports net sales decreased eur mn january june 2009 eur mn corresponding period 2008,negative
cargo traffic fell year year tonnes september 2009,negative
cash flow investments amounted eur45 eur46,negative
coca cola market leader manufacturers market share 2.2 corresponding period 2004 2005,negative
comparable operating profit decreased eur 13.8 mn eur 17.1 mn corresponding period 2005,negative
consolidated operating profit continuing operations decreased eur 51.2 mn eur mn 2007,negative
consolidated pretax profit decreased eur mn eur mn 2007,negative
device volume area decreased 21 2.7 mn units,negative
diluted earnings share eps declined eur eur,negative
diluted earnings share eps fell eur eur,negative
eur5 .9 h1 09 august 2009 finnish media group ilkka yhtyma oyj hel ilk2s said today net profit fell 45 year eur5 .9 half 2009,negative
earnings share eps amounted eur1 eur2 .30,negative
earnings share eps 2005 decreased eur1 eur1 2003,negative
earnings share eps half 2007 amounted eur0 eur0 year ago,negative
finnair total traffic decreased 8.7 terms revenue passenger kilometres,negative
finnish business software group affectogenimap oyj said net profit 1.2 mln euro 1.5 mln months 2006 2.2 mln euro 2.8 mln period 2005,negative
finnish financial software solutions developer basware oyj said net profit fell euro 1.2 mln quarter 2007 2.0 mln euro 2.7 mln year earlier,negative
finnish glass technology company glaston oyj abp net profit decreased 2.6 mln euro 3.8 mln months 2007 7.8 mln euro 11.4 mln period 2006,negative
"finnish management software solutions provider ixonos oyj net profit decreased euro 575,000 quarter 2008 euro 1.0 mln period 2007",negative
finnish media company talentum oyj net profit decreased 2.5 mln euro 4.0 mln quarter 2008 3.0 mln euro 4.7 mln period 2007,negative
finnish metal products company componenta oyj net profit went slightly 25.1 mln euro 40.2 mln half 2008 25.4 mln euro mln period 2007,negative
separate announcement helsinki stock exchange atria revealed company quarter profits declined eur13 .9 quarter year eur12 .7 year q3,negative
fourth quarter 2008 net sales decreased eur mn eur mn fourth quarter 2007,negative
insurer par cs slid eur citigroup ing slashed targets stock,negative
adp news feb 11 2009 finnish wood products technology supplier raute oyj hel rutav said today net profit decreased eur 4.7 million usd 6.1 2008 eur 6.6 million 2007,negative
adp news feb 12 2009 finnish construction company lemminkainen oyj hel lem1s said today net profit decreased eur million usd 2008 eur million 2007,negative
adp news feb 2009 finnish broadband data communication systems solutions company teleste oyj hel tlt1v said today net profit decreased eur 5.5 million usd 7.2 2008 eur 9.4 million 200,negative
adp news jan 22 2009 finnish mobile phones maker nokia oyj omx nok1v said today operating profit decreased eur billion usd 6.5 bn 2008 eur billion 2007,negative
adpnews 2010 finnish cutlery hand tools maker fiskars oyj abp hel fisas said today net profit declined eur million usd 17 quarter 2010 eur 17 million correspond,negative
adpnews oct 21 2009 finland based consultancy tieto oyj hel said today net profit eur million usd 43.9 months 2009 eur 58.7 million period,negative
market share decreased route helsinki finland tallinn estonia 0.1 percentage points 24.8,negative
net profit fell half 5.5 million 9.4 million end 2007,negative
net profit months march 31 fell x20ac 103 million us$ million x20ac million year earlier finnish company said,negative
net sales decreased eur mn eur mn corresponding period 2009,negative
net sales decreased eur mn eur corresponding period 2005,negative
net sales fell 33 quarter 2008 eur mn,negative
net sales fell previous accounting period,negative
net sales kyro main business area glaston technologies manufacturer glass processing machines decreased eur mn eur mn january september 2005,negative
operating profit decreased eur eur 21.1 mn 2008,negative
operating profit fell eur 7.9 mn second quarter 2005 eur 5.1 mn second quarter 2006,negative
operating profit fell eur 15.1 mn eur 24.6 mn 2006,negative
operating profit fell eur mn eur mn,negative
operating profit fell eur 38.1 mn eur mn 2007,negative
operating profit fell eur 6.2 mn eur 8.5 mn quarter 2007,negative
orion net profit quarter 2007 decreased mln euro mln mln euro 57.5 mln year earlier,negative
pretax profit decreased 37 eur mn eur mn,negative
pretax profit decreased eur 33.8 mn eur 40.8 mn fourth quarter 2005,negative
pretax profit totaled eur 9.0 mn eur mn 2007,negative
prices delivery volumes broadband products decreased significantly 2005,negative
profit period fell eur 1.6 mn eur 7.5 mn january september 2008,negative
profit period totalled eur 0.8 mn eur 1.1 mn corresponding period 2008,negative
profit period totalled eur 1.1 mn eur 1.6 mn quarter 2008,negative
revenue quarter fell percent euro 2.4 billion compared year earlier,negative
srv lowered net sales estimate 2008 uncertainties housing sales,negative
stora enso oyj said second quarter result fall half compared period 2007,negative
subscription sales decreased slightly,negative
company confirmed estimate lower revenue 2009 year ago .9 given interim report august 2009,negative
company said fall turnover planned,negative
department store division sales fell 8.6 eur mn,negative
fair value company investment properties went eur billion end 2009 eur billion year earlier,negative
fair value company investment properties went eur2 bn end september 2009 eur2 bn year earlier,negative
group order portfolio decreased eur 42.9 mn 2007 eur mn 2008,negative
net sales decreased eur million eur million,negative
sales tiimari segment fell 4.0 year year eur3 .3 june 2010,negative
finnish electronics contract manufacturer scanfil net sales eur mn quarter 2007 eur mn year,negative
alma media operating profit amounted eur 11.9 mn eur mn year earlier,negative
commission income decreased eur 3.8 mn compared eur 4.6 mn quarter 2007,negative
commission income fell eur 4.6 mn eur 5.1 mn corresponding period 2007,negative
export declined percent 16.4 million liters,negative
exports goods fell 59 imports 16.7,negative
finnish developer manufacturer mobile phone chargers salcomp plc omx helsinki sal1v wednesday 19 november lowered year net sales estimate,negative
finnish investment group oyj said net profit fell 23.5 mln euro 30.6 mln 2006 mln euro mln 2005,negative
group ebit half eur13 .6 us$ 17.8 falling short eur22 .5 posted period 2009,negative
market share shrank cent 48 cent year earlier,negative
company saw net profit quarter eur 1.4 million eur 1.5 million corresponding period 2009,negative
company saw net profit quarter eur1 .4 eur1 .5 corresponding period 2009,negative
net sales declined eur million eur 1.2 billion,negative
food trade sales amounted .1 decline 1.1,negative
january november 2009 group sales totalled eur mn drop 12.6 period 2008,negative
july september 2009 konecranes sales decreased eur mn eur mn july september 2008,negative
sales volume coca cola market share decreased 2.2 24.2,negative
september market declined percent year year 19.28 million liters,negative
baltic countries development operations reorganisation continued non recurring items related takeover process lowered earnings,negative
baltic countries sales fell 40.2 russia 23.2 terms euros terms local currency,negative
baltic countries sales fell,negative
nokia shares 3.3 percent lower 12.73,negative
nokia shares hit euros friday 50 percent start year introduction touch screen models,negative
operating profit decreased eur 11.2 mn eur 16.6 mn,negative
operating profit decreased nearly eur 1.7 mn,negative
operating profit fell eur 20.3 mn eur mn second quarter 2008,negative
operating profit fourth quarter fell eur33 eur39 year earlier,negative
operating profit totaled eur 3.8 mn eur 4.5 mn corresponding period 2005,negative
operating profit totaled eur 6.7 mn eur 7.2 mn corresponding period 2005,negative
operating profit totaled eur 9.4 mn eur 11.7 mn 2004,negative
operating profit totalled eur 1.22 mn eur mn quarter 2008,negative
operating profit totalled eur mn eur 43.8 mn year earlier,negative
operating profit totalled eur 9.0 mn eur 9.7 mn half 2008,negative
operating profit totalled eur 9.6 mn eur mn year,negative
operating profit eur -0.1 mn eur 1.3 mn,negative
profit period eur 10.9 mn eur 14.3 mn 2009,negative
revenue slightly x20ac 495 million million compared x20ac million year earlier,negative
sales tiimari business went eur 11.8 million gallerix stores saw 29 growth eur million,negative
sales seppala cent,negative
talentum net sales september smaller expected,negative
company previous estimate lower revenue year ago eur 93.9 million,negative
company profit totaled ls h1 2007 30.9 year year,negative
company said sales months end march slid .4 us$ .2 year,negative
operating margin came 2.4 5.7,negative
operating margin aker yards cruise ferries division went 8.3 6.4 quarter 2007,negative
terms aforementioned funding considerably bank current levels market maturity ranging 7.5 years,negative
total capital funds managed bank decreased 28 eur end september 2008,negative
upm stock fell percent euro 12.49 early afternoon trading helsinki,negative
yit baltic sales quarters 2008 totaled million euros representing drop 29 percent year year,negative
according company operating profit excluding non recurring items fourth quarter 2009 significantly better expected better figures fourth quarter 2008,positive
extremely delighted project continuation cooperation viking line,positive
apartment block located easy reach city center close school,positive
share issue pre right shareholders comprising million new shares market price offered subscription shareholders holders capital notes professional clients,neutral
eb tough voip designed fulfill communications needs units continue goal '' mikko eb elektrobit defense products wireless solutions senior manager said statement,neutral
low energy consumption flexible chf pro '',neutral
antibody administered repeated doses mg kg generally tolerated pharmacokinetic characteristics btt-1023 psoriasis patients consistent observed previously completed study rheumatoid arthritis ra patients,neutral
